{
  "$schema": "https://json-schema.org/draft/2020-12/schema",
  "$id": "https://skill-atoms.com/schemas/atom-v1.json",
  "title": "skill-atoms v1 skill atom",
  "description": "A skill atom is a discoverable, invocable unit of AI capability. It bundles a bounded task description, a system-prompt fragment the agent loads on invocation, and metadata for catalog routing, versioning, and trust gating.",
  "type": "object",
  "required": [
    "schema",
    "type",
    "id",
    "version",
    "name",
    "description"
  ],
  "additionalProperties": false,
  "if": {
    "properties": { "type": { "const": "ai-hook" } },
    "required": ["type"]
  },
  "then": {
    "required": ["schema", "type", "id", "version", "name", "description", "events", "lang", "install_path", "wire_on_install"]
  },
  "else": {
    "required": ["schema", "type", "id", "version", "name", "description", "system_prompt_fragment", "applicable_domains"]
  },
  "properties": {
    "schema": {
      "type": "string",
      "const": "https://skill-atoms.com/schemas/atom-v1.json"
    },
    "type": {
      "type": "string",
      "enum": [
        "skill",
        "skill-set",
        "invocation-contract",
        "ai-hook"
      ],
      "description": "skill — a single bounded capability; skill-set — a named group of related skills loaded together; invocation-contract — a schema describing how a skill may be called (inputs, outputs, side-effects); ai-hook — a governance hook script (Python or shell) that fires on Claude Code or git events."
    },
    "id": {
      "type": "string",
      "pattern": "^[a-z0-9][a-z0-9-]*(?:/[a-z0-9-]+)*$",
      "description": "Stable, human-readable identifier. Use kebab-case segments separated by forward slashes, e.g. 'code/code-review'."
    },
    "version": {
      "type": "string",
      "pattern": "^[0-9]+\\.[0-9]+\\.[0-9]+(?:-[A-Za-z0-9.-]+)?$",
      "description": "SemVer. Patch for prompt tweaks; minor for new fields; major for breaking signature changes."
    },
    "name": {
      "type": "string",
      "minLength": 1,
      "maxLength": 80,
      "description": "Short human-readable display name."
    },
    "description": {
      "type": "string",
      "minLength": 1,
      "maxLength": 1000,
      "description": "What this skill does and when to use it."
    },
    "system_prompt_fragment": {
      "type": "string",
      "minLength": 1,
      "description": "The instruction text injected into the agent's system prompt when this skill is loaded. Write in second person imperative. Must be self-contained — do not reference other atoms by assumption."
    },
    "applicable_domains": {
      "type": "array",
      "minItems": 1,
      "uniqueItems": true,
      "items": {
        "type": "string",
        "minLength": 1
      },
      "description": "Routing tags used by the Olympus broker to select skills. Examples: code, review, debug, write, commit, deploy."
    },
    "invocation_contract": {
      "$ref": "#/$defs/invocationContract",
      "description": "Optional formal contract describing inputs, outputs, and side-effects for programmatic invocation."
    },
    "authored_by": {
      "type": "string",
      "minLength": 1,
      "description": "Signing key identifier of the atom's primary author."
    },
    "signed_by": {
      "type": "array",
      "uniqueItems": true,
      "items": {
        "type": "string",
        "minLength": 1
      },
      "description": "Additional endorsement signatures."
    },
    "tags": {
      "type": "array",
      "uniqueItems": true,
      "items": {
        "type": "string",
        "minLength": 1
      },
      "description": "Free-form discovery tags beyond applicable_domains."
    },
    "lifecycle": {
      "type": "string",
      "enum": [
        "draft",
        "stable",
        "deprecated",
        "retired"
      ],
      "default": "draft"
    },
    "superseded_by": {
      "type": "string",
      "description": "ID of the skill that replaces this one when lifecycle is deprecated or retired."
    },
    "depends_on": {
      "type": "array",
      "items": {
        "type": "string"
      },
      "description": "Slugs of skills this skill depends on. Installing this skill also installs all listed dependencies.",
      "uniqueItems": true
    },
    "category": {
      "type": "string",
      "enum": [
        "coding",
        "dotnet",
        "data",
        "design",
        "product",
        "operations",
        "finance",
        "legal",
        "sales",
        "marketing",
        "hr",
        "support",
        "knowledge",
        "governance"
      ],
      "description": "Single primary category for grouping skills in selection/presentation. Mirrors schema-atoms /v1/skill.schema.json."
    },
    "events": {
      "type": "array",
      "uniqueItems": true,
      "items": {
        "type": "string",
        "minLength": 1
      },
      "description": "Claude Code or git hook events this hook fires on (e.g. PreToolUse, PostToolUse, SessionStart, SessionEnd, Stop, SubagentStop, UserPromptSubmit). Empty array for data files or git hooks."
    },
    "lang": {
      "type": "string",
      "enum": ["python", "shell", "data"],
      "description": "Implementation language of the hook script. Use 'data' for JSON pattern libraries or other non-executable artifacts."
    },
    "install_path": {
      "type": "string",
      "minLength": 1,
      "description": "Destination path for the hook script on install, relative to the user's home directory (e.g. ~/.ai/hooks/audit.py)."
    },
    "wire_on_install": {
      "type": "boolean",
      "description": "When true, the installer wires this hook into the Claude Code settings.json hooks block automatically."
    }
  },
  "$defs": {
    "invocationContract": {
      "type": "object",
      "required": [
        "inputs",
        "outputs"
      ],
      "additionalProperties": false,
      "properties": {
        "inputs": {
          "type": "array",
          "items": {
            "$ref": "#/$defs/contractField"
          }
        },
        "outputs": {
          "type": "array",
          "items": {
            "$ref": "#/$defs/contractField"
          }
        },
        "side_effects": {
          "type": "array",
          "items": {
            "type": "string",
            "minLength": 1
          },
          "description": "Human-readable descriptions of observable side effects (e.g. 'writes a file', 'calls an external API')."
        }
      }
    },
    "contractField": {
      "type": "object",
      "required": [
        "name",
        "type"
      ],
      "additionalProperties": false,
      "properties": {
        "name": {
          "type": "string",
          "minLength": 1
        },
        "type": {
          "type": "string",
          "minLength": 1
        },
        "description": {
          "type": "string"
        },
        "required": {
          "type": "boolean",
          "default": true
        }
      }
    }
  }
}
