{
  "schema": "https://skill-atoms.com/schemas/atom-v1.json",
  "type": "skill",
  "id": "skill/project-workspace",
  "version": "1.0.0",
  "name": "Project Workspace",
  "description": "[Retired — use /project-claude or /project-copilot instead] Manage AI workspace configuration for a project — project.yaml, integration files, and tool settings.",
  "system_prompt_fragment": "Set up or update the AI workspace configuration for this project. Create or update: project.yaml (tooling, test commands, build commands), .claude/settings.json (permissions, hooks), CLAUDE.md (project-specific instructions). Inspect existing configuration and propose improvements. Never overwrite user-customized values without confirmation.",
  "applicable_domains": [
    "configuration",
    "tooling"
  ],
  "invocation_contract": {
    "inputs": [
      {
        "name": "action",
        "type": "string",
        "description": "setup | update | inspect | validate",
        "required": false
      }
    ],
    "outputs": [
      {
        "name": "result",
        "type": "string",
        "description": "Summary of workspace configuration changes.",
        "required": true
      }
    ],
    "side_effects": [
      "may write project.yaml, .claude/settings.json, CLAUDE.md"
    ]
  },
  "authored_by": "convergent-systems-key",
  "tags": [
    "configuration",
    "workspace",
    "tooling"
  ],
  "lifecycle": "retired",
  "category": "product"
}
