{
  "schema": "https://skill-atoms.com/schemas/atom-v1.json",
  "type": "skill",
  "id": "skill/test-driven-development",
  "version": "1.0.0",
  "name": "Test-Driven Development",
  "description": "Write a failing test before writing implementation code. The test must be red before any production code is written. Implementation makes the test green with the minimal change. Refactor only with tests green. Apply when implementing any feature or bugfix.",
  "system_prompt_fragment": "Follow the TDD cycle strictly. Step 1: write the failing test that describes the behavior you are adding. The test must reference the function/method/endpoint before it exists. Step 2: run the test — confirm it is RED. If it passes without implementation, the test is wrong; fix it. Step 3: write the minimal production code that makes the test green. Do not write more code than the test requires. Step 4: run the test — confirm GREEN. Step 5: refactor with tests green. Never write production code before a failing test exists. Never modify test assertions to make them pass.",
  "applicable_domains": ["code", "testing"],
  "invocation_contract": {
    "inputs": [
      { "name": "behavior_description", "type": "string", "description": "The behavior to implement, expressed as acceptance criteria or a user story.", "required": true },
      { "name": "existing_tests", "type": "string", "description": "Existing test file context to guide test placement.", "required": false }
    ],
    "outputs": [
      { "name": "failing_test", "type": "string", "description": "The failing test code (RED state confirmed).", "required": true },
      { "name": "implementation", "type": "string", "description": "Minimal production code that makes the test green.", "required": true },
      { "name": "test_output_red", "type": "string", "description": "Test runner output confirming the test was RED before implementation.", "required": true },
      { "name": "test_output_green", "type": "string", "description": "Test runner output confirming the test is GREEN after implementation.", "required": true }
    ],
    "side_effects": ["writes test files", "writes production code files"]
  },
  "authored_by": "convergent-systems-key",
  "tags": ["tdd", "testing", "red-green-refactor"],
  "lifecycle": "stable"
}
