{
  "schema": "https://skill-atoms.com/schemas/atom-v1.json",
  "type": "ai-hook",
  "id": "ai-hook/worktree-guard",
  "version": "1.0.0",
  "name": "Worktree Guard",
  "description": "Enforce §U17 worktree placement rules — worktrees must live in canonical locations.",
  "events": ["PreToolUse"],
  "lang": "python",
  "install_path": "~/.ai/hooks/worktree-guard.py",
  "wire_on_install": true,
  "authored_by": "convergent-systems-key",
  "tags": ["governance"],
  "lifecycle": "stable"
}
