{
  "schema": "https://skill-atoms.com/schemas/atom-v1.json",
  "type": "ai-hook",
  "id": "ai-hook/secret-precommit",
  "version": "1.0.0",
  "name": "Secret Precommit",
  "description": "Git pre-commit hook that scans staged files for secrets before they are committed.",
  "events": [],
  "lang": "python",
  "install_path": "~/.ai/hooks/secret-precommit.py",
  "wire_on_install": false,
  "authored_by": "convergent-systems-key",
  "tags": ["governance"],
  "lifecycle": "stable"
}
